{
  "auction_id": "auc_981",
  "serve_token": "stk_abcxyz123",
  "winner": {
    "brand_agent_id": "brand_agent_123",
    "campaign_id": "cmp_nimbus_launch",
    "product_id": "prod_nimbus_crm",
    "cpx_price": "5",
    "cpc_price": "145",
    "cpa_price": null,
    "billable_unit": "CPC"
  },
  "render": {
    "format": "weave",
    "weave_content": "[Ad] For startups needing higher limits and automated expense workflows. CRM built for growing teams, with AI-assisted workflows. Learn more: https://admesh.click/stk_abcxyz123"
  },
  "ttl_ms": 60000
}
